{"assertions":{"low_all_numeric":true,"normal_score_order":"high > medium > low","system_failure_failed_rules":["B-PROH-01"],"system_failure_ne_scope":["issue_framing","decision_and_consensus"],"system_failure_unaffected_matches_medium":true},"cases":[{"case_id":"exercise-b-high-001","failed_system_rules":[],"ne_dimensions":[],"numeric_dimensions":7,"opportunities":{"invalid":0,"not_offered":0,"offered":15,"with_candidate_response":15},"scores":{"collaboration_and_relationship":4,"decision_and_consensus":4,"issue_framing":4,"listening_and_response":4,"logical_reasoning":4,"process_and_time_management":3,"valuable_contribution":4},"session_id":"exercise-b-high-001","state":"high","system_quality":"pass"},{"case_id":"exercise-b-medium-001","failed_system_rules":[],"ne_dimensions":[],"numeric_dimensions":7,"opportunities":{"invalid":0,"not_offered":0,"offered":15,"with_candidate_response":15},"scores":{"collaboration_and_relationship":3,"decision_and_consensus":3,"issue_framing":3,"listening_and_response":3,"logical_reasoning":3,"process_and_time_management":2,"valuable_contribution":3},"session_id":"exercise-b-medium-001","state":"medium","system_quality":"pass"},{"case_id":"exercise-b-low-001","failed_system_rules":[],"ne_dimensions":[],"numeric_dimensions":7,"opportunities":{"invalid":0,"not_offered":0,"offered":15,"with_candidate_response":15},"scores":{"collaboration_and_relationship":1,"decision_and_consensus":1,"issue_framing":1,"listening_and_response":2,"logical_reasoning":1,"process_and_time_management":1,"valuable_contribution":1},"session_id":"exercise-b-low-001","state":"low","system_quality":"pass"},{"case_id":"exercise-b-system-failure-001","failed_system_rules":["B-PROH-01"],"ne_dimensions":["issue_framing","decision_and_consensus"],"numeric_dimensions":5,"opportunities":{"invalid":4,"not_offered":0,"offered":11,"with_candidate_response":11},"scores":{"collaboration_and_relationship":3,"decision_and_consensus":"NE","issue_framing":"NE","listening_and_response":3,"logical_reasoning":3,"process_and_time_management":2,"valuable_contribution":3},"session_id":"exercise-b-system-failure-001","state":"system_failure","system_quality":"fail"}],"contract_version":"0.1","controls":{"core_state_literals":[],"normal_state_ai_messages_equal":true,"normal_state_opportunity_supply_equal":true,"normal_state_system_quality_equal":true,"runner_receives_state_label":false},"dimensions":["issue_framing","logical_reasoning","listening_and_response","valuable_contribution","collaboration_and_relationship","decision_and_consensus","process_and_time_management"],"exercise_id":"candidate-assessment-b-stakeholder-conflict","matrix_id":"exercise-b-four-state-v0.1","runner_version":"generic-full-episode-runner-v0.1","scenario_version":"candidate-assessment-b-v0.1","states":["high","medium","low","system_failure"]}
