{"assertions":{"low_all_numeric":true,"normal_score_order":"high > medium > low","system_failure_failed_rules":["A-PROH-01","A-R01"],"system_failure_ne_scope":["issue_framing","valuable_contribution"],"system_failure_unaffected_matches_medium":true},"cases":[{"case_id":"exercise-a-high-001","failed_system_rules":[],"ne_dimensions":[],"numeric_dimensions":7,"opportunities":{"invalid":0,"not_offered":0,"offered":12,"with_candidate_response":12},"scores":{"collaboration_and_relationship":4,"decision_and_consensus":4,"issue_framing":4,"listening_and_response":4,"logical_reasoning":4,"process_and_time_management":3,"valuable_contribution":4},"session_id":"exercise-a-high-001","state":"high","system_quality":"pass"},{"case_id":"exercise-a-medium-001","failed_system_rules":[],"ne_dimensions":[],"numeric_dimensions":7,"opportunities":{"invalid":0,"not_offered":0,"offered":12,"with_candidate_response":12},"scores":{"collaboration_and_relationship":3,"decision_and_consensus":3,"issue_framing":3,"listening_and_response":3,"logical_reasoning":2,"process_and_time_management":2,"valuable_contribution":2},"session_id":"exercise-a-medium-001","state":"medium","system_quality":"pass"},{"case_id":"exercise-a-low-001","failed_system_rules":[],"ne_dimensions":[],"numeric_dimensions":7,"opportunities":{"invalid":0,"not_offered":0,"offered":12,"with_candidate_response":12},"scores":{"collaboration_and_relationship":2,"decision_and_consensus":1,"issue_framing":1,"listening_and_response":2,"logical_reasoning":1,"process_and_time_management":1,"valuable_contribution":1},"session_id":"exercise-a-low-001","state":"low","system_quality":"pass"},{"case_id":"exercise-a-system-failure-001","failed_system_rules":["A-PROH-01","A-R01"],"ne_dimensions":["issue_framing","valuable_contribution"],"numeric_dimensions":5,"opportunities":{"invalid":5,"not_offered":0,"offered":7,"with_candidate_response":7},"scores":{"collaboration_and_relationship":3,"decision_and_consensus":3,"issue_framing":"NE","listening_and_response":3,"logical_reasoning":2,"process_and_time_management":2,"valuable_contribution":"NE"},"session_id":"exercise-a-system-failure-001","state":"system_failure","system_quality":"fail"}],"contract_version":"0.1","controls":{"core_state_literals":[],"normal_state_ai_messages_equal":true,"normal_state_opportunity_supply_equal":true,"normal_state_system_quality_equal":true,"runner_receives_state_label":false},"dimensions":["issue_framing","logical_reasoning","listening_and_response","valuable_contribution","collaboration_and_relationship","decision_and_consensus","process_and_time_management"],"exercise_id":"candidate-assessment-a-ambiguous-structure","matrix_id":"exercise-a-four-state-v0.1","runner_version":"generic-full-episode-runner-v0.1","scenario_version":"candidate-assessment-a-v0.1","states":["high","medium","low","system_failure"]}
